<?xml version="1.0" encoding="UTF-8"?>
<xs:schema xmlns:xs="http://www.w3.org/2001/XMLSchema" elementFormDefault="qualified">
    <xs:element name="ENSA_TANGER">
        <xs:complexType>
            <xs:sequence>
                <xs:element name="Filiere" minOccurs="0" maxOccurs="6">
                    <xs:complexType>
                        <xs:sequence>
                            <xs:element name="Niveau" minOccurs="0" maxOccurs="3">
                                <xs:complexType>
                                    <xs:sequence>
                                        <xs:element name="Eleve" minOccurs="0" maxOccurs="unbounded">
                                            <xs:complexType>
                                                <xs:sequence>
                                                    <xs:element name="DateSuppression">
                                                        <xs:complexType>
                                                            <xs:sequence>
                                                            </xs:sequence>
                                                            <xs:attribute name="date" type="xs:string"/>
                                                            <xs:attribute name="heure" type="xs:string"/>
                                                        </xs:complexType>
                                                    </xs:element>
                                                    <xs:element name="Notes" minOccurs="0" maxOccurs="unbounded">
                                                        <xs:complexType>
                                                            <xs:sequence>
                                                                <xs:element name="Note" minOccurs="0" maxOccurs="unbounded">
                                                                    <xs:complexType>
                                                                        <xs:sequence>
                                                                            <xs:element name="note"></xs:element>
                                                                        </xs:sequence>
                                                                        <xs:attribute name="id" type="xs:string"/>
                                                                        <xs:attribute name="code_mat" type="xs:string"/>
                                                                        <xs:attribute name="code_eleve" type="xs:string"/>
                                                                    </xs:complexType>
                                                                </xs:element>
                                                            </xs:sequence>
                                                        </xs:complexType>
                                                    </xs:element>
                                                    <xs:element name="Moyenne" minOccurs="0" maxOccurs="unbounded">
                                                        <xs:complexType>
                                                            <xs:sequence>
                                                                <xs:element name="niveau"></xs:element>
                                                                <xs:element name="moyenne"></xs:element>
                                                            </xs:sequence>
                                                            <xs:attribute name="id" type="xs:string"/>
                                                            <xs:attribute name="code_eleve" type="xs:string"/>
                                                            <xs:attribute name="code_fil" type="xs:string"/>
                                                        </xs:complexType>
                                                    </xs:element>
                                                </xs:sequence>
                                                <xs:attribute name="id" type="xs:string"/>
                                                <xs:attribute name="code" type="xs:string"/>
                                                <xs:attribute name="nom" type="xs:string"/>
                                                <xs:attribute name="prenom" type="xs:string"/>
                                                <xs:attribute name="niveau" type="xs:string"/>
                                                <xs:attribute name="code_fil" type="xs:string"/>
                                            </xs:complexType>
                                        </xs:element>
                                    </xs:sequence>
                                    <xs:attribute name="code" type="xs:string"/>
                                </xs:complexType>
                            </xs:element>
                        </xs:sequence>
                        <xs:attribute name="code" type="xs:string"/>
                        <xs:attribute name="designation" type="xs:string"/>
                    </xs:complexType>
                </xs:element>
            </xs:sequence>
        </xs:complexType>
    </xs:element>
</xs:schema>
